{
  "$schema": "https://json-schema.org/draft/2020-12/schema",
  "$id": "https://schemas.stardrive.dev/starconsole/exec-turn.schema.json",
  "title": "ExecTurn",
  "type": "object",
  "additionalProperties": false,
  "required": [
    "schemaVersion",
    "intent",
    "executedSteps",
    "toolCalls",
    "evidenceRefs",
    "changedFiles",
    "checks",
    "outcome"
  ],
  "properties": {
    "schemaVersion": { "const": "1.0" },
    "intent": { "const": "execute" },
    "outcome": { "type": "string", "enum": ["success", "partial", "failed"] },
    "diffSummary": { "type": "string" },
    "nextAction": { "type": "string" },
    "governance": {
      "type": "object",
      "additionalProperties": false,
      "properties": {
        "required": { "type": "boolean" },
        "riskTier": {
          "type": "string",
          "enum": ["low", "moderate", "high", "critical"]
        },
        "approvalRef": { "type": "string", "minLength": 1 }
      }
    },
    "changedFiles": {
      "type": "array",
      "items": { "type": "string", "minLength": 1 }
    },
    "evidenceRefs": {
      "type": "array",
      "minItems": 1,
      "items": { "type": "string", "minLength": 1 }
    },
    "executedSteps": {
      "type": "array",
      "minItems": 1,
      "items": {
        "type": "object",
        "additionalProperties": false,
        "required": ["stepId", "status"],
        "properties": {
          "stepId": { "type": "string", "minLength": 1 },
          "status": { "type": "string", "enum": ["success", "partial", "failed"] },
          "note": { "type": "string" }
        }
      }
    },
    "toolCalls": {
      "type": "array",
      "items": {
        "type": "object",
        "additionalProperties": false,
        "required": ["id", "name", "args", "mode"],
        "properties": {
          "id": { "type": "string", "minLength": 1 },
          "name": { "type": "string", "minLength": 1 },
          "mode": { "type": "string", "enum": ["read", "write"] },
          "args": { "type": "object", "additionalProperties": true }
        }
      }
    },
    "checks": {
      "type": "array",
      "items": {
        "type": "object",
        "additionalProperties": false,
        "required": ["command", "status"],
        "properties": {
          "command": { "type": "string", "minLength": 1 },
          "status": { "type": "string", "enum": ["passed", "failed", "skipped"] },
          "exitCode": { "type": "number" },
          "outputRef": { "type": "string" }
        }
      }
    }
  }
}
